{
  "schema_version": "0.1.0",
  "registry_id": "indus-open-benchmark:research-landscape",
  "generated_at": "2026-07-27T09:49:41+09:00",
  "scope_note": "This registry records scoped source claims and curator assessments. It does not treat sequence regularity, image classification, visual similarity, or a published interpretation as a decipherment.",
  "evidence_policy": {
    "A": "Primary artifact, excavation, collection, catalogue, corpus, or official institutional record",
    "B": "Peer-reviewed structural, statistical, or image-processing research",
    "C": "Peer-reviewed linguistic, semantic, functional, or non-linguistic interpretation",
    "D": "Preprint, conference paper, public code, or unreviewed dataset requiring audit",
    "E": "Self-published, informal, or provenance-poor claim retained only for tracking and falsification"
  },
  "entries": [
    {
      "entry_id": "official-asi-status-2025",
      "title": "ASI conference brief: Decipherment of Indus Script — Current Status and Way Forward",
      "entity_type": "official_record",
      "evidence_tier": "A",
      "tier_rationale": "The record was issued by the Archaeological Survey of India for its 2025 conference.",
      "status": "verified",
      "citation": {
        "creators": [
          "Archaeological Survey of India"
        ],
        "issued": "2025",
        "publisher_or_venue": "Archaeological Survey of India",
        "doi": null,
        "other_identifiers": [
          "ASI document 771"
        ],
        "links": [
          {
            "link_type": "official_record",
            "url": "https://asi.nic.in/admin/whatsnew/download/771"
          }
        ]
      },
      "claim": {
        "kind": "institutional_statement",
        "attribution": "source_reported",
        "acceptance": "supported",
        "statement": "The official conference brief identifies the absence of a bilingual inscription, short texts, and uncertainty about the writing system and underlying language as central obstacles.",
        "scope": "ASI's stated remit and problem framing for its August 2025 conference; not a ruling on any proposed decipherment."
      },
      "evidence": [
        {
          "evidence_type": "official_statement",
          "support": "direct",
          "description": "The conference document explicitly lists the principal limitations and invites presentations on the current status and way forward.",
          "locator": "https://asi.nic.in/admin/whatsnew/download/771"
        }
      ],
      "limitations": [
        {
          "category": "institutional",
          "verification": "verified",
          "statement": "A conference brief documents institutional framing; it is not a systematic consensus statement or prize-adjudication decision."
        }
      ],
      "falsification": {
        "applicability": "audit_only",
        "criteria": [
          "Re-check the official record and any later ASI correction or superseding conference report."
        ],
        "current_result": "not_tested",
        "notes": "The entry records what ASI stated, not whether every obstacle is permanent."
      },
      "access_rights": {
        "access_method": "public_download",
        "rights_status": "unknown",
        "license_id": null,
        "redistribution": false,
        "permitted_use": "link_only",
        "statement": "The official PDF is publicly downloadable, but no redistribution licence was verified; this registry stores only metadata and a paraphrase.",
        "rights_evidence_url": null
      },
      "lineage": {
        "source_registry_ids": [],
        "upstream_entry_ids": [],
        "notes": "Independent official-status record; it does not supply inscription data."
      },
      "dates": {
        "accessed_on": "2026-07-26",
        "verified_on": "2026-07-26",
        "next_review_on": "2026-10-26"
      },
      "tags": [
        "asi",
        "institutional-status",
        "research-obstacles"
      ]
    },
    {
      "entry_id": "corpus-cisi",
      "title": "Corpus of Indus Seals and Inscriptions",
      "entity_type": "corpus",
      "evidence_tier": "A",
      "tier_rationale": "CISI is a primary photographic and catalogue publication series used by later corpora and analyses.",
      "status": "verified",
      "citation": {
        "creators": [
          "Asko Parpola",
          "B. M. Pande",
          "Petteri Koskikallio",
          "CISI volume editors and contributors"
        ],
        "issued": "1987-present",
        "publisher_or_venue": "Finnish Academy of Science and Letters",
        "doi": null,
        "other_identifiers": [
          "CISI"
        ],
        "links": [
          {
            "link_type": "landing_page",
            "url": "https://researchportal.helsinki.fi/en/projects/corpus-of-indus-seals-and-inscriptions/"
          },
          {
            "link_type": "official_record",
            "url": "https://acadsci.fi/en/publications/the-corpus-of-indus-seals-and-inscriptions-3-2-humaniora-383-has-been-published/"
          }
        ]
      },
      "claim": {
        "kind": "observation",
        "attribution": "registry_assessment",
        "acceptance": "established",
        "statement": "CISI is a core photographic and catalogue reference for inscribed Indus objects and supplies upstream identifiers and images used by multiple digital projects.",
        "scope": "The published CISI series and its documented project history, not an inferred machine-readable or openly licensed export."
      },
      "evidence": [
        {
          "evidence_type": "primary_record",
          "support": "direct",
          "description": "The University of Helsinki project record and Finnish Academy publication notice document the corpus project and published volumes.",
          "locator": "https://researchportal.helsinki.fi/en/projects/corpus-of-indus-seals-and-inscriptions/"
        }
      ],
      "limitations": [
        {
          "category": "rights",
          "verification": "unverified",
          "statement": "No comprehensive machine-readable data, photograph, drawing, or transcription redistribution licence was verified."
        },
        {
          "category": "data",
          "verification": "verified",
          "statement": "The corpus is primarily distributed as published volumes rather than a versioned open API or bulk dataset."
        }
      ],
      "falsification": {
        "applicability": "audit_only",
        "criteria": [
          "Verify volume metadata against publisher and library records.",
          "Replace the rights assessment only when content-specific written terms are obtained."
        ],
        "current_result": "not_tested",
        "notes": "Catalogue observations must be transcribed with page, volume, and artifact-level provenance."
      },
      "access_rights": {
        "access_method": "restricted",
        "rights_status": "unknown",
        "license_id": null,
        "redistribution": false,
        "permitted_use": "permission_required",
        "statement": "Bibliographic access is available, but copying or redistributing tables, drawings, photographs, or a derived bulk corpus requires rights review.",
        "rights_evidence_url": null
      },
      "lineage": {
        "source_registry_ids": [
          "cisi"
        ],
        "upstream_entry_ids": [],
        "notes": "This research entry reuses the existing source-registry identifier rather than duplicating artifact-level provenance."
      },
      "dates": {
        "accessed_on": "2026-07-26",
        "verified_on": "2026-07-26",
        "next_review_on": "2027-01-26"
      },
      "tags": [
        "catalogue",
        "cisi",
        "images",
        "primary-corpus"
      ]
    },
    {
      "entry_id": "corpus-mahadevan-1977",
      "title": "The Indus Script: Texts, Concordance and Tables",
      "entity_type": "corpus",
      "evidence_tier": "A",
      "tier_rationale": "Mahadevan's concordance is a primary published transcription and sign-reference corpus.",
      "status": "verified",
      "citation": {
        "creators": [
          "Iravatham Mahadevan"
        ],
        "issued": "1977",
        "publisher_or_venue": "Archaeological Survey of India",
        "doi": null,
        "other_identifiers": [
          "Memoirs of the Archaeological Survey of India 77"
        ],
        "links": [
          {
            "link_type": "landing_page",
            "url": "https://www.rmrl.in/en/irc"
          }
        ]
      },
      "claim": {
        "kind": "observation",
        "attribution": "registry_assessment",
        "acceptance": "established",
        "statement": "Mahadevan 1977 established a widely used text corpus, sign list, concordance, and reference-number system for Indus inscriptions.",
        "scope": "Bibliographic and corpus role; no linguistic reading is imported as observation."
      },
      "evidence": [
        {
          "evidence_type": "primary_record",
          "support": "direct",
          "description": "RMRL's Indus Research Centre identifies the 1977 publication as the basis for its IndusScript application.",
          "locator": "https://www.rmrl.in/en/irc"
        }
      ],
      "limitations": [
        {
          "category": "rights",
          "verification": "unverified",
          "statement": "No open licence was verified for machine-readable tables, sign artwork, or a bulk transcription export."
        },
        {
          "category": "data",
          "verification": "verified",
          "statement": "Later discoveries and competing sign classifications require explicit version and crosswalk handling."
        }
      ],
      "falsification": {
        "applicability": "audit_only",
        "criteria": [
          "Check every cited count and sign identifier against the 1977 edition or a rights-cleared authoritative export."
        ],